participant,free_texts,feedback,food_amount,trial_stop_time,image_order,ratings,categories,conditionOrder,training_image_order,shape_discrete_slider.response,color_discrete_slider.response,tail_discrete_slider.response,shape_direction_slider.response,color_direction_slider.response,tail_direction_slider.response,shape_continuous_slider.response,color_continuous_slider.response,tail_continuous_slider.response
005,"['He was hungry, but the sperk was spicy so he only needed bit', ""It's available to him and he's small so he needs more food to grow"", ""He is yellow and that's a dominant color so he eats more"", 'He has round shapes, so he needs an even number of food', 'His curly tail requires it.', 'He had a hard night, so he needs to fill his belly', 'It was avavailable, so why not?', ""He's a stupid animal so all he does it eat what is in front of him"", 'His rectangle shape needs 6 of food', 'To clean his plate like a good boy', 'His momma sperk told him to', 'he was storing up for the winter', 'To impress a lady sperk', 'It was the amount he was given', 'He was being bullied into eating, so he ate it all', 'So he could grow up bgi and strong', 'He stole it and wanted to destory the evidence', 'Why not?', 'It tasted yummy.', 'He was king of the sperks so he needed the most food.', 'It was time for dinner', 'The zoo guests wanted to see it.', 'He wss hungy', 'That was the amount he was given by the zookeeper.']","[""The study was kind of confusing as I didn't know what i was trying to help with. But it was easy to complete.""]","[2.0, 4.0, 5.0, 2.0, 3.0, 6.0, 5.0, 6.0, 6.0, 4.0, 6.0, 4.0, 4.0, 4.0, 5.0, 5.0, 4.0, 6.0, 4.0, 7.0, 4.0, 7.0, 6.0, 4.0, 2.0]",1109.5906,"['T_B_S', 'T_B_C', 'N_B_C', 'N_Y_C', 'N_B_S', 'T_Y_S', 'T_Y_C', 'N_Y_S']","[5.0, 4.0, 3.0, 5.0, 5.0, 7.0, 3.0, 7.0]","['high', 'medium', 'low', 'low', 'medium', 'high', 'medium', 'medium']",5,"['N_B_C', 'N_B_S', 'N_Y_S', 'N_Y_C', 'T_Y_C', 'T_B_S', 'T_Y_S', 'T_B_C', 'T_B_S', 'T_B_C', 'N_B_C', 'N_B_S', 'T_Y_S', 'T_Y_C', 'N_Y_S', 'N_Y_C', 'N_B_S', 'T_B_C', 'T_B_S', 'T_Y_C', 'N_Y_C', 'T_Y_S', 'N_B_C', 'N_Y_S', 'N_B_C']",No,No,Yes,,,,,,2.0
001,"['That was the amount of it’s required caloric intake\xa0', 'That was the amount required for daily caloric intake\xa0', 'That was the amount it wanted to eat', 'That’s the amount it wanted to eat', 'That’s what it requires\xa0', 'That’s what it requires\xa0', 'That’s what it wanted to eat', 'That’s what it needed', 'Because that’s what is required to sustain biological life\xa0', 'Because that is the amount it was given', 'Because that was what it was given', 'That’s what it ate that day', 'It needed nourishment\xa0', 'To feed properly\xa0', 'Because that is what it had to eat', 'So it would starve', 'It was gluttonous\xa0', 'It needed to replace the calories expended\xa0', 'Because it lacks intelligence\xa0', 'It needed to eat', 'Because it’s yellow', 'Because it’s yellow with a tail', 'Because it’s not loved', 'It’s dying']","['Repetitive, hard to pay attention to the different variations when I always needed to explain why it eats a quantity of food']","[10.0, 3.0, 6.0, 4.0, 6.0, 5.0, 2.0, 2.0, 5.0, 5.0, 4.0, 4.0, 7.0, 5.0, 5.0, 1.0, 7.0, 6.0, 3.0, 6.0, 6.0, 7.0, 6.0, 1.0, 10.0]",480.349,"['N_Y_C', 'N_B_C', 'N_Y_S', 'T_B_C', 'T_B_S', 'N_B_S', 'T_Y_C', 'T_Y_S']","[4.0, 8.0, 6.0, 7.0, 8.0, 4.0, 6.0, 6.0]","['low', 'low', 'medium', 'medium', 'high', 'medium', 'medium', 'high']",1,"['T_Y_S', 'N_Y_C', 'T_B_S', 'N_B_S', 'N_Y_S', 'T_Y_C', 'T_B_C', 'N_B_C', 'N_Y_S', 'T_B_S', 'N_B_C', 'T_Y_C', 'T_Y_S', 'T_B_C', 'N_B_S', 'N_Y_C', 'N_B_S', 'T_Y_C', 'N_B_C', 'T_B_S', 'N_Y_S', 'T_Y_S', 'T_B_C', 'N_Y_C', 'T_Y_S']",No,No,No,,,,,,
006,"['it was just enough to make it full', 'it was more hungry today', 'it didn;t have enough to eat before and now it is hungrier', 'it needs more food than the round one', 'it was very hungry', 'it was just the right amount', 'it was hungry', 'it needed more than before', 'it needed more food than yesterday', 'it is growing bigger', ""it didn't eat much maybe sick"", 'it needs more food because it is pregnant', 'it wasnt hungry', 'it ate too much earlier', 'it is hungry', 'was not hungry', 'it was already full', 'it was being greedy', 'it was there', 'I dont know', 'it is sick', 'it was bored', 'it didnt want anyone else to eat it', 'it was hungry']",[],"[2.0, 4.0, 8.0, 6.0, 9.0, 5.0, 7.0, 5.0, 6.0, 6.0, 3.0, 6.0, 3.0, 2.0, 5.0, 2.0, 3.0, 8.0, 6.0, 7.0, 1.0, 5.0, 6.0, 7.0, 2.0]",338.2275,"['N_B_C', 'T_Y_C', 'T_B_C', 'N_B_S', 'N_Y_C', 'N_Y_S', 'T_Y_S', 'T_B_S']","[5.0, 4.0, 6.0, 6.0, 7.0, 8.0, 8.0, 9.0]","['low', 'medium', 'medium', 'medium', 'low', 'medium', 'high', 'high']",6,"['N_Y_C', 'N_B_C', 'T_Y_C', 'N_Y_S', 'T_B_S', 'T_B_C', 'N_B_S', 'T_Y_S', 'T_B_S', 'N_B_S', 'T_Y_C', 'T_Y_S', 'N_Y_S', 'N_B_C', 'T_B_C', 'N_Y_C', 'N_Y_C', 'T_Y_C', 'T_B_S', 'T_Y_S', 'N_B_C', 'N_B_S', 'T_B_C', 'N_Y_S', 'N_Y_C']",Yes,No,No,Square,,,5.0,,
004,"[""Because of it's body shape"", ""Because of it's body shape"", ""Because of it's color"", ""Because of it's body color"", ""Because of it's color"", ""Because of it's shape"", ""Because of it's tail"", ""Because of it's shape"", ""Because of it's tail"", ""Because it doesn't have a tail"", 'Color', 'Shape', 'Tail', 'Shape', 'Shape', 'Color', 'Tail', 'Color', 'Color', 'Tail', 'Shape', 'Shape', 'Tail', 'Shape']",[],"[1.0, 7.0, 3.0, 5.0, 6.0, 6.0, 4.0, 8.0, 5.0, 5.0, 4.0, 8.0, 8.0, 3.0, 3.0, 2.0, 6.0, 5.0, 7.0, 9.0, 1.0, 4.0, 6.0, 5.0, 1.0]",321.644,"['T_Y_S', 'T_B_S', 'N_Y_C', 'N_Y_S', 'N_B_S', 'N_B_C', 'T_B_C', 'T_Y_C']","[7.0, 7.0, 1.0, 4.0, 4.0, 2.0, 7.0, 5.0]","['high', 'high', 'low', 'medium', 'medium', 'low', 'medium', 'medium']",4,"['N_B_C', 'N_B_S', 'N_Y_C', 'T_B_S', 'T_B_C', 'N_Y_S', 'T_Y_C', 'T_Y_S', 'T_B_C', 'N_B_S', 'T_Y_C', 'T_B_S', 'T_Y_S', 'N_B_C', 'N_Y_S', 'N_Y_C', 'T_B_C', 'N_B_S', 'N_Y_S', 'T_B_S', 'N_Y_C', 'N_B_C', 'T_Y_S', 'T_Y_C', 'N_B_C']",Yes,Yes,Yes,Square,Yellow,Having a tail,3.0,4.0,5.0
002,"[""Because it's large in size frame so it needs more."", ""Medium sized frame so it didn't need much."", 'Smallish frame so didnt need much.', 'It is yellow and large framed so needs much.\xa0', 'Yellow and medium to large frame so needs much.\xa0', 'Blue and medium to large frame so needs much.\xa0', 'Medium frame and blue.\xa0', 'Large frame and blue.\xa0', 'Medium to large frame and yellow.\xa0', 'Large frame, blue.\xa0', 'Large frame, blue.\xa0', 'Round frame yellow.\xa0', 'Square frame and blue.\xa0', 'Square frame and yellow.\xa0', 'Round frame yellow.\xa0', 'Blue and round frame or body.\xa0', 'Rectangle body yellow.\xa0', 'Yellow and rectangle body frame.\xa0', 'Round frame yellow with a tail.', 'Rectangle body blue no tail.\xa0', 'Rectangle body blue and a tail.\xa0', 'Round frame yellow no tail.', 'Round frame blue no tail.\xa0', 'Round frame blue with tail.']",[],"[8.0, 7.0, 2.0, 5.0, 7.0, 5.0, 3.0, 6.0, 8.0, 7.0, 7.0, 4.0, 5.0, 6.0, 6.0, 4.0, 4.0, 8.0, 5.0, 6.0, 5.0, 2.0, 2.0, 5.0, 8.0]",496.7672,"['T_Y_S', 'N_B_S', 'N_Y_C', 'T_B_C', 'T_Y_C', 'N_Y_S', 'T_B_S', 'N_B_C']","[8.0, 4.0, 4.0, 7.0, 8.0, 5.0, 8.0, 5.0]","['high', 'medium', 'low', 'medium', 'medium', 'medium', 'high', 'low']",2,"['T_Y_S', 'T_B_C', 'N_Y_C', 'T_Y_C', 'N_Y_S', 'T_B_S', 'N_B_S', 'N_B_C', 'T_Y_S', 'T_B_S', 'T_B_C', 'N_Y_C', 'N_B_S', 'N_Y_S', 'T_Y_C', 'N_B_C', 'N_Y_S', 'T_Y_S', 'T_Y_C', 'N_B_S', 'T_B_S', 'N_Y_C', 'N_B_C', 'T_B_C', 'T_Y_S']",Yes,Yes,Yes,Square,Yellow,Having a tail,6.0,5.0,5.0
003,"['It needs that much food to thrive.\xa0', 'It needs that amount of food to function.', 'It needs thst amount of food to thrive and not starve.\xa0', 'It needs that amount of food to function.\xa0', 'It needs that amount of food to thrive.\xa0', 'It wasn’t that hungry and had eaten something before.\xa0', 'It’s circular and dosent need that much food.\xa0', 'It’s circular and just needs 3 to function.\xa0', 'It’s rectangular and needs a lot of food.\xa0', 'It’s circular, yellow and needs that amount of food.\xa0', 'It’s rectangular dark blue and needs that amount to function.\xa0', 'It’s circular and dosen’t need a lot of food.', 'It needs that amount of food.\xa0', 'It’s circular and needs that amount of food.\xa0', 'It’s rectangular and needs that amount of food.\xa0', 'It needs that amount of food to function.\xa0', 'It has a circular shape and needs that amount of food to thrive.\xa0', 'It’s rectangular big and was very hungry.\xa0', 'It had eaten a lot of food before and only needed a small amount of food to function.\xa0', 'It ate this amount because it’s rectangular and was hungry.\xa0', 'It needed that much food for the night.\xa0', 'It’s circular and only needed a small amount of food.\xa0', 'It’s circular dark blue and only needed a small amount of food.\xa0', 'It’s circular and only needed that amount of food to function.\xa0']",[],"[10.0, 5.0, 5.0, 5.0, 6.0, 2.0, 2.0, 3.0, 7.0, 5.0, 5.0, 2.0, 6.0, 4.0, 5.0, 3.0, 6.0, 9.0, 4.0, 6.0, 5.0, 2.0, 2.0, 5.0, 10.0]",638.806,"['T_B_C', 'N_B_C', 'N_Y_C', 'T_Y_S', 'T_B_S', 'N_Y_S', 'T_Y_C', 'N_B_S']","[4.0, 3.0, 4.0, 6.0, 5.0, 7.0, 8.0, 6.0]","['medium', 'low', 'low', 'high', 'high', 'medium', 'medium', 'medium']",3,"['T_B_S', 'N_B_S', 'T_Y_C', 'T_Y_S', 'T_B_C', 'N_Y_S', 'N_B_C', 'N_Y_C', 'T_Y_S', 'T_Y_C', 'N_B_S', 'N_B_C', 'T_B_C', 'N_Y_C', 'T_B_S', 'N_Y_S', 'T_B_C', 'T_Y_S', 'N_Y_S', 'N_B_S', 'T_B_S', 'N_Y_C', 'N_B_C', 'T_Y_C', 'T_B_S']",Yes,Yes,No,Square,Blue,,6.0,5.0,
